"record_id","headword","headword_raw","headword_normalized","homonym_number","classification","classification_family","translation_raw","sense_count","senses_json","example_count","examples_json","variant_count","variants_json","comments_raw","source_code","source_document","page_start","page_end","transcription_status","publication_status","validation_status"
"RD-000001","A","A","a","","Vt","Vt","Buscar","1","[""Buscar""]","1","[""Nijeni ama cahué. Voy a buscar el caballo. ¡Ábasi! ¡Vayan a buscarlo! [pret.: ari; fut.: ama] Ábia simíbari, fueron a buscarlo. Abo, lo buscaremos, uds. lo buscarán. Ásagá, si lo busca. Ásiga, buscándolo. Ay, lo buscaba.""]","1","[""pret.: ari; fut.: ama""]","Nijeni ama cahué. Voy a buscar el caballo. ¡Ábasi! ¡Vayan a buscarlo! [pret.: ari; fut.: ama] Ábia simíbari, fueron a buscarlo. Abo, lo buscaremos, uds. lo buscarán. Ásagá, si lo busca. Ásiga, buscándolo. Ay, lo buscaba.","SRC-02","DICCIONARIO raramuri.pdf","3","3","Transcrito","Autorizada para difusión","Pendiente de validación lingüística"
"RD-000002","Abé","Abé","abe","","Adv","Adv","Hoy","1","[""Hoy""]","1","[""1. Abé huarú ucuri. Hoy llovió mucho. 2.Hace rato. Véase jipi, curipi.""]","0","[]","1. Abé huarú ucuri. Hoy llovió mucho. 2.Hace rato. Véase jipi, curipi.","SRC-02","DICCIONARIO raramuri.pdf","3","3","Transcrito","Autorizada para difusión","Pendiente de validación lingüística"
"RD-000003","Abi, abiyena","Abi, abiyena","abi, abiyena","","Adv","Adv","Sí","1","[""Sí""]","1","[""¿Acha mi 'yárati? Ayena, abi. ¿Se lo dieron? Sí.""]","1","[""abiyena""]","¿Acha mi 'yárati? Ayena, abi. ¿Se lo dieron? Sí.","SRC-02","DICCIONARIO raramuri.pdf","3","3","Transcrito","Autorizada para difusión","Pendiente de validación lingüística"
"RD-000004","Abijí","Abijí","abiji","","Adv","Adv","Todavía, aún","1","[""Todavía, aún""]","1","[""¡Abijí buhué!, ¡Espera todavía! Abijí que cho ucú, todavía no llueve. I'yábijí temprano todavía. Abijí tibíami, sobrante. Abijí ucú, todavía llueve.""]","0","[]","¡Abijí buhué!, ¡Espera todavía! Abijí que cho ucú, todavía no llueve. I'yábijí temprano todavía. Abijí tibíami, sobrante. Abijí ucú, todavía llueve.","SRC-02","DICCIONARIO raramuri.pdf","3","3","Transcrito","Autorizada para difusión","Pendiente de validación lingüística"
"RD-000005","Aboni","Aboni","aboni","","Pron","Pron","Ellos, ellas","1","[""Ellos, ellas""]","1","[""Aboni pirérachi, habitación de ellos.""]","0","[]","Aboni pirérachi, habitación de ellos.","SRC-02","DICCIONARIO raramuri.pdf","3","3","Transcrito","Autorizada para difusión","Pendiente de validación lingüística"
"RD-000006","Acá","1Acá","aca","1","S","S","Cara, nariz","1","[""Cara, nariz""]","1","[""Binoy acara, su cara. Binoy acárachi, en su cara. Véase cho'ó.""]","0","[]","Binoy acara, su cara. Binoy acárachi, en su cara. Véase cho'ó.","SRC-02","DICCIONARIO raramuri.pdf","3","3","Transcrito","Autorizada para difusión","Pendiente de validación lingüística"
"RD-000007","Acá","2Acá","aca","2","Vi","Vi","1. Tener sal 2. Está dulce o sabroso","2","[""Tener sal"",""Está dulce o sabroso""]","1","[""¿Acha gará acá muní?, ¿Tienen suficiente sal los frijoles? Hue gará acá je'ná muní, están muy bien de sal estos frijoles.""]","0","[]","¿Acha gará acá muní?, ¿Tienen suficiente sal los frijoles? Hue gará acá je'ná muní, están muy bien de sal estos frijoles.","SRC-02","DICCIONARIO raramuri.pdf","3","3","Transcrito","Autorizada para difusión","Pendiente de validación lingüística"
"RD-000008","Acá","3Acá","aca","3","S","S","Huarache","1","[""Huarache""]","1","[""Nijeni quetasi te acá, no tengo huaraches.""]","0","[]","Nijeni quetasi te acá, no tengo huaraches.","SRC-02","DICCIONARIO raramuri.pdf","3","3","Transcrito","Autorizada para difusión","Pendiente de validación lingüística"
"RD-000009","Acará","Acará","acara","","Vi","Vi","Poner (huaraches)","1","[""Poner (huaraches)""]","0","[]","0","[]","","SRC-02","DICCIONARIO raramuri.pdf","3","3","Transcrito","Autorizada para difusión","Pendiente de validación lingüística"
"RD-000010","Acarapu","Acarapu","acarapu","","Vi","Vi","Quitarse (huaraches)","1","[""Quitarse (huaraches)""]","0","[]","0","[]","","SRC-02","DICCIONARIO raramuri.pdf","3","3","Transcrito","Autorizada para difusión","Pendiente de validación lingüística"
"RD-000011","Acarapta","Acarapta","acarapta","","Vt","Vt","Quitar (huaraches)","1","[""Quitar (huaraches)""]","0","[]","0","[]","","SRC-02","DICCIONARIO raramuri.pdf","3","3","Transcrito","Autorizada para difusión","Pendiente de validación lingüística"
"RD-000012","Acá","4Acá","aca","4","Vi","Vi","Embotarse, quitarse (el filo)","1","[""Embotarse, quitarse (el filo)""]","1","[""Ripurá acari, se embotó el hacha.""]","0","[]","Ripurá acari, se embotó el hacha.","SRC-02","DICCIONARIO raramuri.pdf","3","3","Transcrito","Autorizada para difusión","Pendiente de validación lingüística"
"RD-000013","Acáami","Acáami","acaami","","Adj","Adj","1. Salado 2. Dulce","2","[""Salado"",""Dulce""]","0","[]","0","[]","","SRC-02","DICCIONARIO raramuri.pdf","3","3","Transcrito","Autorizada para difusión","Pendiente de validación lingüística"
"RD-000014","Acáanami","Acáanami","acaanami","","Adj","Adj","Sano de pie o de brazo (se usa negativamente)","1","[""Sano de pie o de brazo (se usa negativamente)""]","1","[""Echi rijoy que acáanami ju, mapujiti binoy ronórachi nacórami ju, Ese hombre es cojo porque tiene la pierna chueca. Que acáanami, cojo. Que acanáami biréana ronochí, cojo de una pierna.""]","0","[]","Echi rijoy que acáanami ju, mapujiti binoy ronórachi nacórami ju, Ese hombre es cojo porque tiene la pierna chueca. Que acáanami, cojo. Que acanáami biréana ronochí, cojo de una pierna.","SRC-02","DICCIONARIO raramuri.pdf","3","3","Transcrito","Autorizada para difusión","Pendiente de validación lingüística"
"RD-000015","Acabó","Acabó","acabo","","S","S","Hoyo de la nariz, ventana de la nariz","1","[""Hoyo de la nariz, ventana de la nariz""]","0","[]","0","[]","","SRC-02","DICCIONARIO raramuri.pdf","3","3","Transcrito","Autorizada para difusión","Pendiente de validación lingüística"
"RD-000016","Acáchura","Acáchura","acachura","","S","S","1. Abuela paterna 2. Nieta (de la abuela paterna)","2","[""Abuela paterna"",""Nieta (de la abuela paterna)""]","1","[""Echi nijé onorá iyera nijé acáchura ju, la mamá de mi papá es mi abuela paterna. Nijé acáchura, mi abuela (la mamá de mi papá).""]","0","[]","Echi nijé onorá iyera nijé acáchura ju, la mamá de mi papá es mi abuela paterna. Nijé acáchura, mi abuela (la mamá de mi papá).","SRC-02","DICCIONARIO raramuri.pdf","3","4","Transcrito","Autorizada para difusión","Pendiente de validación lingüística"
"RD-000017","Acahui","Acahui","acahui","","Vt","Vt","Salar","1","[""Salar""]","0","[]","0","[]","","SRC-02","DICCIONARIO raramuri.pdf","4","4","Transcrito","Autorizada para difusión","Pendiente de validación lingüística"
"RD-000018","Acajihua","Acajihua","acajihua","","S","S","Correa","1","[""Correa""]","1","[""Acajihua ma su'rari, ya se soltó la correa del huarache.""]","0","[]","Acajihua ma su'rari, ya se soltó la correa del huarache.","SRC-02","DICCIONARIO raramuri.pdf","4","4","Transcrito","Autorizada para difusión","Pendiente de validación lingüística"
"RD-000019","Acajihua","Acajihua","acajihua","","Vr","Vr","Ponerse correas a los huaraches","1","[""Ponerse correas a los huaraches""]","1","[""Nijé acajíhuara, mis correas""]","0","[]","Nijé acajíhuara, mis correas","SRC-02","DICCIONARIO raramuri.pdf","4","4","Transcrito","Autorizada para difusión","Pendiente de validación lingüística"
"RD-000020","Acami","Acami","acami","","Adj sing","Adj","Vivo","1","[""Vivo""]","1","[""Abijí acami ju cochí, todavía está vivo el perro.""]","0","[]","Abijí acami ju cochí, todavía está vivo el perro.","SRC-02","DICCIONARIO raramuri.pdf","4","4","Transcrito","Autorizada para difusión","Pendiente de validación lingüística"
"RD-000021","Acaná","Acaná","acana","","Adv","Adv","Boca abajo","1","[""Boca abajo""]","1","[""Acaná huichiri, se cayó boca abajo. ¡Acaná achá bitori! ¡Voltea el cajete (boca abajo)!""]","0","[]","Acaná huichiri, se cayó boca abajo. ¡Acaná achá bitori! ¡Voltea el cajete (boca abajo)!","SRC-02","DICCIONARIO raramuri.pdf","4","4","Transcrito","Autorizada para difusión","Pendiente de validación lingüística"
"RD-000022","Acánami","Acánami","acanami","","Pp","Pp","Aliviado (de pie, brazo, etc.), sano así","1","[""Aliviado (de pie, brazo, etc.), sano así""]","0","[]","0","[]","","SRC-02","DICCIONARIO raramuri.pdf","4","4","Transcrito","Autorizada para difusión","Pendiente de validación lingüística"
"RD-000023","Acará","1Acará","acara","1","Vt","Vt","Herrar","1","[""Herrar""]","0","[]","0","[]","","SRC-02","DICCIONARIO raramuri.pdf","4","4","Transcrito","Autorizada para difusión","Pendiente de validación lingüística"
"RD-000024","Acará","2Acará","acara","2","S","S","Rostro","1","[""Rostro""]","0","[]","0","[]","","SRC-02","DICCIONARIO raramuri.pdf","4","4","Transcrito","Autorizada para difusión","Pendiente de validación lingüística"
"RD-000025","Acha","Acha","acha","","Adv","Adv","¿Acaso…? (solo se usa en preguntas)","1","[""¿Acaso…? (solo se usa en preguntas)""]","1","[""¿Acha gará ju?, ¿Estás bien? ¿Quecha gará ju?, ¿No estás bien?""]","0","[]","¿Acha gará ju?, ¿Estás bien? ¿Quecha gará ju?, ¿No estás bien?","SRC-02","DICCIONARIO raramuri.pdf","4","4","Transcrito","Autorizada para difusión","Pendiente de validación lingüística"
"RD-000026","Achá","Achá","acha","","Vt","Vt","Poner (una sola cosa o persona), colocar","1","[""Poner (una sola cosa o persona), colocar""]","1","[""Echo'ná achámani, voy a ponerlo allí. Nijeni naquiri echo'ná achayá, yo quería ponerlo allí. Echo'ná achárati, fue puesto allí. Sicochi achari rité, puso la piedra en el rincón. [pl.: muchuhua]""]","1","[""pl.: muchuhua""]","Echo'ná achámani, voy a ponerlo allí. Nijeni naquiri echo'ná achayá, yo quería ponerlo allí. Echo'ná achárati, fue puesto allí. Sicochi achari rité, puso la piedra en el rincón. [pl.: muchuhua]","SRC-02","DICCIONARIO raramuri.pdf","4","4","Transcrito","Autorizada para difusión","Pendiente de validación lingüística"
"RD-000027","Achagó","Achagó","achago","","S","S","Una mata espinosa (semejante a la manzanilla; las chivas comen las ramitas)","1","[""Una mata espinosa (semejante a la manzanilla; las chivas comen las ramitas)""]","1","[""Achagóachi, lugar donde hay esa mata.""]","0","[]","Achagóachi, lugar donde hay esa mata.","SRC-02","DICCIONARIO raramuri.pdf","4","4","Transcrito","Autorizada para difusión","Pendiente de validación lingüística"
"RD-000028","Achapa","Achapa","achapa","","Vt","Vt","Golpear ropa o cobija sobre una roca o con un palo para quitar el agua.","1","[""Golpear ropa o cobija sobre una roca o con un palo para quitar el agua.""]","0","[]","0","[]","","SRC-02","DICCIONARIO raramuri.pdf","4","4","Transcrito","Autorizada para difusión","Pendiente de validación lingüística"
"RD-000029","'Aché","'Aché","'ache","","Vi","Vi","Atiesarse (de frío), morirse (de frío)","1","[""Atiesarse (de frío), morirse (de frío)""]","1","[""Biré táa tohuí 'acheca mucuri, mapujiti quetasi teri quima, un niño chiquito se atiesó, y murió así, porque no tenía cobija.""]","0","[]","Biré táa tohuí 'acheca mucuri, mapujiti quetasi teri quima, un niño chiquito se atiesó, y murió así, porque no tenía cobija.","SRC-02","DICCIONARIO raramuri.pdf","4","4","Transcrito","Autorizada para difusión","Pendiente de validación lingüística"
"RD-000030","Achí","Achí","achi","","Vt","Vt","Reír, sonreír","1","[""Reír, sonreír""]","1","[""Echi jaré rarámuri huabé achiri maparí nijé huichiri, los tarahumaras se rieron mucho cuando me caí.""]","0","[]","Echi jaré rarámuri huabé achiri maparí nijé huichiri, los tarahumaras se rieron mucho cuando me caí.","SRC-02","DICCIONARIO raramuri.pdf","4","4","Transcrito","Autorizada para difusión","Pendiente de validación lingüística"
"RD-000031","Achíami","Achíami","achiami","","Adj","Adj","Risueño","1","[""Risueño""]","0","[]","0","[]","","SRC-02","DICCIONARIO raramuri.pdf","4","4","Transcrito","Autorizada para difusión","Pendiente de validación lingüística"
"RD-000032","Achigó yiri ju","Achigó yiri ju","achigo yiri ju","","","Sin clasificar","Es igual","1","[""Es igual""]","1","[""Véase néchigo""]","0","[]","Véase néchigo","SRC-02","DICCIONARIO raramuri.pdf","4","4","Transcrito","Autorizada para difusión","Pendiente de validación lingüística"
"RD-000033","Achigórigá","Achigórigá","achigoriga","","Adv","Adv","De la misma manera, así también","1","[""De la misma manera, así también""]","1","[""Echi rijoy nihuari biré namuti achigórigá mapurigá rihuari echo'ná huarúrachi, ese hombre hizo una cosa de la misma manera que vió en la ciudad.""]","0","[]","Echi rijoy nihuari biré namuti achigórigá mapurigá rihuari echo'ná huarúrachi, ese hombre hizo una cosa de la misma manera que vió en la ciudad.","SRC-02","DICCIONARIO raramuri.pdf","4","4","Transcrito","Autorizada para difusión","Pendiente de validación lingüística"
"RD-000034","A'huí","A'huí","a'hui","","Vi","Vi","Brotar, nacer o germinar (semillas)","1","[""Brotar, nacer o germinar (semillas)""]","1","[""[pret.: a'huiri, fut.: a'huimea]""]","1","[""pret.: a'huiri, fut.: a'huimea""]","[pret.: a'huiri, fut.: a'huimea]","SRC-02","DICCIONARIO raramuri.pdf","4","4","Transcrito","Autorizada para difusión","Pendiente de validación lingüística"
"RD-000035","Ahuínari","Ahuínari","ahuinari","","Adv pl","Adv","Solos","1","[""Solos""]","1","[""[sing.: bi'neri]""]","1","[""sing.: bi'neri""]","[sing.: bi'neri]","SRC-02","DICCIONARIO raramuri.pdf","4","4","Transcrito","Autorizada para difusión","Pendiente de validación lingüística"
"RD-000036","A'huínari","A'huínari","a'huinari","","Adv","Adv","Aparte","1","[""Aparte""]","1","[""Aboni a'huínara niráa napahuiri, ellos se juntaron aparte de los demás.""]","0","[]","Aboni a'huínara niráa napahuiri, ellos se juntaron aparte de los demás.","SRC-02","DICCIONARIO raramuri.pdf","4","4","Transcrito","Autorizada para difusión","Pendiente de validación lingüística"
"RD-000037","Ajó","1Ajó","ajo","1","Vt","Vt","Desgranar maíz","1","[""Desgranar maíz""]","0","[]","0","[]","","SRC-02","DICCIONARIO raramuri.pdf","4","4","Transcrito","Autorizada para difusión","Pendiente de validación lingüística"
"RD-000038","Ajó","2Ajó","ajo","2","S","S","Mosquito, zancudo","1","[""Mosquito, zancudo""]","0","[]","0","[]","","SRC-02","DICCIONARIO raramuri.pdf","5","5","Transcrito","Autorizada para difusión","Pendiente de validación lingüística"
"RD-000039","A'lara","A'lara","a'lara","","Vt","Vt","Mejorar, arreglar, preparar","1","[""Mejorar, arreglar, preparar""]","1","[""Hue charé buhué; auchecho cu a'larabo, está muy malo el camino; lo arreglaremos. Vease ca'rara""]","1","[""véase ca'rara""]","Hue charé buhué; auchecho cu a'larabo, está muy malo el camino; lo arreglaremos. Vease ca'rara","SRC-02","DICCIONARIO raramuri.pdf","5","5","Transcrito","Autorizada para difusión","Pendiente de validación lingüística"
"RD-000040","Alimuri","Alimuri","alimuri","","S","S","Decalitro","1","[""Decalitro""]","0","[]","0","[]","","SRC-02","DICCIONARIO raramuri.pdf","5","5","Transcrito","Autorizada para difusión","Pendiente de validación lingüística"
"RD-000041","Amá","Amá","ama","","S","S","Hígado","1","[""Hígado""]","0","[]","0","[]","","SRC-02","DICCIONARIO raramuri.pdf","5","5","Transcrito","Autorizada para difusión","Pendiente de validación lingüística"
"RD-000042","Amaré","Amaré","amare","","Vi","Vi","Tener hígado","1","[""Tener hígado""]","1","[""Huáasi amará, hígado de vaca""]","0","[]","Huáasi amará, hígado de vaca","SRC-02","DICCIONARIO raramuri.pdf","5","5","Transcrito","Autorizada para difusión","Pendiente de validación lingüística"
"RD-000043","Amachí","Amachí","amachi","","Vt","Vt","Rezar","1","[""Rezar""]","1","[""Echi jaré pagótami mo'huiri echo'ná pachá ri'obachi; ma amachima, la gente ya entró en la iglesia; van a rezar.""]","0","[]","Echi jaré pagótami mo'huiri echo'ná pachá ri'obachi; ma amachima, la gente ya entró en la iglesia; van a rezar.","SRC-02","DICCIONARIO raramuri.pdf","5","5","Transcrito","Autorizada para difusión","Pendiente de validación lingüística"
"RD-000044","Amachícarahuami","Amachícarahuami","amachicarahuami","","Adj","Adj","Perteneciente a la acción de rezar","1","[""Perteneciente a la acción de rezar""]","0","[]","0","[]","","SRC-02","DICCIONARIO raramuri.pdf","5","5","Transcrito","Autorizada para difusión","Pendiente de validación lingüística"
"RD-000045","Amarú","Amarú","amaru","","Vi","Vi","Estar entero","1","[""Estar entero""]","1","[""Auchériga atí bachí; abijí amarúami ju, así está la cabalaza; todavía está enter.""]","0","[]","Auchériga atí bachí; abijí amarúami ju, así está la cabalaza; todavía está enter.","SRC-02","DICCIONARIO raramuri.pdf","5","5","Transcrito","Autorizada para difusión","Pendiente de validación lingüística"
"RD-000046","Amarúami","Amarúami","amaruami","","Adj","Adj","Entero","1","[""Entero""]","0","[]","0","[]","","SRC-02","DICCIONARIO raramuri.pdf","5","5","Transcrito","Autorizada para difusión","Pendiente de validación lingüística"
"RD-000047","Amí","Amí","ami","","Vt","Vt","Buscar","1","[""Buscar""]","1","[""Nijeni simea huenomí ámia, voy a buscar dinero Símabo huenomí ábia, vamos a buscar dinero. ¡Amí!, ¡Vaya a buscarlo! Ámia simiri, fue a buscarlo.""]","0","[]","Nijeni simea huenomí ámia, voy a buscar dinero Símabo huenomí ábia, vamos a buscar dinero. ¡Amí!, ¡Vaya a buscarlo! Ámia simiri, fue a buscarlo.","SRC-02","DICCIONARIO raramuri.pdf","5","5","Transcrito","Autorizada para difusión","Pendiente de validación lingüística"
"RD-000048","Amígohua","Amígohua","amigohua","","S","S","Amigo","1","[""Amigo""]","1","[""Nijé amígohuara, mis amigos""]","0","[]","Nijé amígohuara, mis amigos","SRC-02","DICCIONARIO raramuri.pdf","5","5","Transcrito","Autorizada para difusión","Pendiente de validación lingüística"
"RD-000049","Amóo, amoque","Amóo, amoque","amoo, amoque","","S","S","Panal, miel de abeja","1","[""Panal, miel de abeja""]","1","[""Huamí ripá coráachi chucú biré amóo, allá arriba, en la escarpadura, está colgado un panal.""]","1","[""amoque""]","Huamí ripá coráachi chucú biré amóo, allá arriba, en la escarpadura, está colgado un panal.","SRC-02","DICCIONARIO raramuri.pdf","5","5","Transcrito","Autorizada para difusión","Pendiente de validación lingüística"
"RD-000050","Aná","1Aná","ana","1","Adv","Adv","De otro modo","1","[""De otro modo""]","1","[""Aná cho niráa ra'ichari, habló de otro modo.""]","0","[]","Aná cho niráa ra'ichari, habló de otro modo.","SRC-02","DICCIONARIO raramuri.pdf","5","5","Transcrito","Autorizada para difusión","Pendiente de validación lingüística"
"RD-000051","Aná","2Aná","ana","2","S","S","1. Ala 2. Aleta","2","[""Ala"",""Aleta""]","1","[""Churuguí anará, alas de pájaro Rochí anará, aletas de pez""]","0","[]","Churuguí anará, alas de pájaro Rochí anará, aletas de pez","SRC-02","DICCIONARIO raramuri.pdf","5","5","Transcrito","Autorizada para difusión","Pendiente de validación lingüística"
"RD-000052","A’nabáa","A’nabáa","a'nabaa","","Vi","Vi","Juntarse","1","[""Juntarse""]","1","[""Jena’í piréami pagótami a’nabáari echo’ná comurachi, la gente de aquí se juntó en la casa de la comunidad""]","0","[]","Jena’í piréami pagótami a’nabáari echo’ná comurachi, la gente de aquí se juntó en la casa de la comunidad","SRC-02","DICCIONARIO raramuri.pdf","5","5","Transcrito","Autorizada para difusión","Pendiente de validación lingüística"
"RD-000053","Anacha","Anacha","anacha","","Vi","Vi","Aguantar","1","[""Aguantar""]","1","[""Maparí rarajípari, échi rijoy quetasi anáchari, cuando corrieron con la bolsa, ese hombre no aguantó. Biquiyá norí chopi anáchari, solamente aguantó tres vueltas. Ne huabé ocó ramichí; nijeni quetasi omero huaminabi anacha, me duele mucho la muela; no puedo aguantarla más. [pret.: anáchari; fut.: anachama]""]","1","[""pret.: anáchari; fut.: anachama""]","Maparí rarajípari, échi rijoy quetasi anáchari, cuando corrieron con la bolsa, ese hombre no aguantó. Biquiyá norí chopi anáchari, solamente aguantó tres vueltas. Ne huabé ocó ramichí; nijeni quetasi omero huaminabi anacha, me duele mucho la muela; no puedo aguantarla más. [pret.: anáchari; fut.: anachama]","SRC-02","DICCIONARIO raramuri.pdf","5","5","Transcrito","Autorizada para difusión","Pendiente de validación lingüística"
"RD-000054","Anachapa","Anachapa","anachapa","","Vi","Vi","Aletear","1","[""Aletear""]","0","[]","0","[]","","SRC-02","DICCIONARIO raramuri.pdf","5","5","Transcrito","Autorizada para difusión","Pendiente de validación lingüística"
"RD-000055","A’nagú","A’nagú","a'nagu","","Adv","Adv","Mutuamente, unos a otros","1","[""Mutuamente, unos a otros""]","0","[]","0","[]","","SRC-02","DICCIONARIO raramuri.pdf","5","5","Transcrito","Autorizada para difusión","Pendiente de validación lingüística"
"RD-000056","Anahué","Anahué","anahue","","Vi","Vi","Aletear","1","[""Aletear""]","0","[]","0","[]","","SRC-02","DICCIONARIO raramuri.pdf","5","5","Transcrito","Autorizada para difusión","Pendiente de validación lingüística"
"RD-000057","Anahui","Anahui","anahui","","Vt","Vt","Medir, pesar","1","[""Medir, pesar""]","1","[""Gará anáhuari echi sunú, mapurigá ibiri chópirigá chapimea, midieron bien el maíz, para que cada uno reciba la misma cantidad. [pret.: anpahuari; fut.: anáhuima]""]","1","[""pret.: anpahuari; fut.: anáhuima""]","Gará anáhuari echi sunú, mapurigá ibiri chópirigá chapimea, midieron bien el maíz, para que cada uno reciba la misma cantidad. [pret.: anpahuari; fut.: anáhuima]","SRC-02","DICCIONARIO raramuri.pdf","5","6","Transcrito","Autorizada para difusión","Pendiente de validación lingüística"
"RD-000058","A’nahuí","A’nahuí","a'nahui","","Adv","Adv","1. Al mismo tiempo 2. igual","2","[""Al mismo tiempo"",""igual""]","1","[""A’nahuí ochérari, nacieron al mismo tiempo. Ne a’nahuí buyari, salieron al mismo tiempo. Ocuánica ne a'nahuí ju, los dos son iguales. A'nahuí ju, son iguales""]","0","[]","A’nahuí ochérari, nacieron al mismo tiempo. Ne a’nahuí buyari, salieron al mismo tiempo. Ocuánica ne a'nahuí ju, los dos son iguales. A'nahuí ju, son iguales","SRC-02","DICCIONARIO raramuri.pdf","6","6","Transcrito","Autorizada para difusión","Pendiente de validación lingüística"
"RD-000059","A'najata","A'najata","a'najata","","Vt","Vt","Perseguir","1","[""Perseguir""]","1","[""Echi rijoy quimá chigósari, echijiti a'najátabo, ese hombre se robó una cobija; por eso lo perseguiremos. [pret.: a'najátari; fut.: a’najátama]""]","1","[""pret.: a'najátari; fut.: a’najátama""]","Echi rijoy quimá chigósari, echijiti a'najátabo, ese hombre se robó una cobija; por eso lo perseguiremos. [pret.: a'najátari; fut.: a’najátama]","SRC-02","DICCIONARIO raramuri.pdf","6","6","Transcrito","Autorizada para difusión","Pendiente de validación lingüística"
"RD-000060","A'namótami","A'namótami","a'namotami","","Adv","Adv","Uno encima del otro","1","[""Uno encima del otro""]","0","[]","0","[]","","SRC-02","DICCIONARIO raramuri.pdf","6","6","Transcrito","Autorizada para difusión","Pendiente de validación lingüística"
"RD-000061","A'namótana","A'namótana","a'namotana","","Vt","Vt","Poner (uno encima del otro)","1","[""Poner (uno encima del otro)""]","1","[""Napabuca a'namótana muchúhuari, las puso una encima de la otra, haciendo un montón.""]","0","[]","Napabuca a'namótana muchúhuari, las puso una encima de la otra, haciendo un montón.","SRC-02","DICCIONARIO raramuri.pdf","6","6","Transcrito","Autorizada para difusión","Pendiente de validación lingüística"
"RD-000062","Anara","Anara","anara","","Vt","Vt","Igualar","1","[""Igualar""]","0","[]","0","[]","","SRC-02","DICCIONARIO raramuri.pdf","6","6","Transcrito","Autorizada para difusión","Pendiente de validación lingüística"
"RD-000063","A'nayáhuari","A'nayáhuari","a'nayahuari","","S pl","S","Los que vivieron hace mucho, los espíritus de los antepasados","1","[""Los que vivieron hace mucho, los espíritus de los antepasados""]","1","[""Jaré rarámuri mayé mapu echi jaré qui'yá piréami pagótami arihuá abijí 'yena jena'í, echijiti maparí echi jaré rarámuri huabé majajáratami ju, rocogó niráa, aboni mayé mapu a'nayáhuari 'yena. Algunos tarahumaras creen que los espíritus de los que vivieron hace mucho todavía andan aquí, por eso, cuando ellos están muy asustados en la noche, creen que los espíritus de los antepasados andan por ahí.""]","0","[]","Jaré rarámuri mayé mapu echi jaré qui'yá piréami pagótami arihuá abijí 'yena jena'í, echijiti maparí echi jaré rarámuri huabé majajáratami ju, rocogó niráa, aboni mayé mapu a'nayáhuari 'yena. Algunos tarahumaras creen que los espíritus de los que vivieron hace mucho todavía andan aquí, por eso, cuando ellos están muy asustados en la noche, creen que los espíritus de los antepasados andan por ahí.","SRC-02","DICCIONARIO raramuri.pdf","6","6","Transcrito","Autorizada para difusión","Pendiente de validación lingüística"
