"record_id","headword","headword_raw","headword_normalized","homonym_number","classification","classification_family","translation_raw","sense_count","senses_json","example_count","examples_json","variant_count","variants_json","comments_raw","source_code","source_document","page_start","page_end","transcription_status","publication_status","validation_status"
"RD-000543","Coséhuari","Coséhuari","cosehuari","","S","S","Gorgojo (come la lana de las cobijas), termita","1","[""Gorgojo (come la lana de las cobijas), termita""]","0","[]","0","[]","","SRC-02","DICCIONARIO raramuri.pdf","29","29","Transcrito","Autorizada para difusión","Pendiente de validación lingüística"
"RD-000544","Cosibé","Cosibé","cosibe","","Vt","Vt","Poner banca (para sentarse","1","[""Poner banca (para sentarse""]","0","[]","0","[]","","SRC-02","DICCIONARIO raramuri.pdf","29","29","Transcrito","Autorizada para difusión","Pendiente de validación lingüística"
"RD-000545","Cosibera","Cosibera","cosibera","","","Sin clasificar","1. s Banquillo 2. vi Tener un banquillo","2","[""s Banquillo"",""vi Tener un banquillo""]","1","[""Asagá cosebeca biré cosibera. Siéntate en una banca.""]","0","[]","Asagá cosebeca biré cosibera. Siéntate en una banca.","SRC-02","DICCIONARIO raramuri.pdf","29","29","Transcrito","Autorizada para difusión","Pendiente de validación lingüística"
"RD-000546","Cosísiya","Cosísiya","cosisiya","","","Sin clasificar","A comer","1","[""A comer""]","1","[""Chotama cosísiya. Comenzarán a comer. Véase co’huá""]","0","[]","Chotama cosísiya. Comenzarán a comer. Véase co’huá","SRC-02","DICCIONARIO raramuri.pdf","29","29","Transcrito","Autorizada para difusión","Pendiente de validación lingüística"
"RD-000547","Cosó","Cosó","coso","","Vi","Vi","Ahogarse (al tragar).","1","[""Ahogarse (al tragar).""]","1","[""Conosó, vi Estar ahogándose (al tragar).""]","0","[]","Conosó, vi Estar ahogándose (al tragar).","SRC-02","DICCIONARIO raramuri.pdf","29","29","Transcrito","Autorizada para difusión","Pendiente de validación lingüística"
"RD-000548","Cotúura","Cotúura","cotuura","","Vi","Vi","Dar comida, llevar a pasto","1","[""Dar comida, llevar a pasto""]","1","[""Sonó cotúuramani cahué. Voy a dar rastrojo al caballo. Rimé cutúuramani echi táa. Le voy a dar tortillas al niño.""]","0","[]","Sonó cotúuramani cahué. Voy a dar rastrojo al caballo. Rimé cutúuramani echi táa. Le voy a dar tortillas al niño.","SRC-02","DICCIONARIO raramuri.pdf","29","29","Transcrito","Autorizada para difusión","Pendiente de validación lingüística"
"RD-000549","Co’yá","Co’yá","co'ya","","Vt pl","Vt","Matar (animales)","1","[""Matar (animales)""]","1","[""[fut.: co’huimea]""]","1","[""fut.: co’huimea""]","[fut.: co’huimea]","SRC-02","DICCIONARIO raramuri.pdf","29","29","Transcrito","Autorizada para difusión","Pendiente de validación lingüística"
"RD-000550","Co’yacha","Co’yacha","co'yacha","","","Sin clasificar","1. s Sombrero 2. vi Ponerse sombrero, anton: co’yapa","2","[""s Sombrero"",""vi Ponerse sombrero, anton: co’yapa""]","0","[]","0","[]","","SRC-02","DICCIONARIO raramuri.pdf","29","29","Transcrito","Autorizada para difusión","Pendiente de validación lingüística"
"RD-000551","Co’yami","Co’yami","co'yami","","S","S","El que come","1","[""El que come""]","0","[]","0","[]","","SRC-02","DICCIONARIO raramuri.pdf","29","29","Transcrito","Autorizada para difusión","Pendiente de validación lingüística"
"RD-000552","Coyé","Coyé","coye","","Vi","Vi","Ponerse el paño de lienzo en la cabeza","1","[""Ponerse el paño de lienzo en la cabeza""]","0","[]","0","[]","","SRC-02","DICCIONARIO raramuri.pdf","29","29","Transcrito","Autorizada para difusión","Pendiente de validación lingüística"
"RD-000553","Coyera","Coyera","coyera","","S","S","Paño para la cabeza, la corona","1","[""Paño para la cabeza, la corona""]","0","[]","0","[]","","SRC-02","DICCIONARIO raramuri.pdf","29","29","Transcrito","Autorizada para difusión","Pendiente de validación lingüística"
"RD-000554","Coyeta","Coyeta","coyeta","","Vt","Vt","Poner el paño (en cabeza de otro)","1","[""Poner el paño (en cabeza de otro)""]","0","[]","0","[]","","SRC-02","DICCIONARIO raramuri.pdf","29","29","Transcrito","Autorizada para difusión","Pendiente de validación lingüística"
"RD-000555","Cu","1Cu","cu","1","Adv","Adv","Otra vez","1","[""Otra vez""]","1","[""Mani cu simea. Ya me voy (otra vez) Ma cu nahuari samichí cu. Ya vino a Samachique otra vez.""]","0","[]","Mani cu simea. Ya me voy (otra vez) Ma cu nahuari samichí cu. Ya vino a Samachique otra vez.","SRC-02","DICCIONARIO raramuri.pdf","29","30","Transcrito","Autorizada para difusión","Pendiente de validación lingüística"
"RD-000556","Cu","2Cu","cu","2","S","S","Leña, madera","1","[""Leña, madera""]","1","[""Cu apera, llevar leña (en el lomo). Cu ca’hui, traer leña.""]","0","[]","Cu apera, llevar leña (en el lomo). Cu ca’hui, traer leña.","SRC-02","DICCIONARIO raramuri.pdf","30","30","Transcrito","Autorizada para difusión","Pendiente de validación lingüística"
"RD-000557","Cu","3Cu","cu","3","Vi","Vi","1. Comer (esquite, granos enteros, fruta dura). Saquí cubo, vamos a comer esquite. 2. Morder. Ta tohuí biré corí cumiri. El niño mordió un chile.","2","[""Comer (esquite, granos enteros, fruta dura). Saquí cubo, vamos a comer esquite."",""Morder. Ta tohuí biré corí cumiri. El niño mordió un chile.""]","0","[]","0","[]","","SRC-02","DICCIONARIO raramuri.pdf","30","30","Transcrito","Autorizada para difusión","Pendiente de validación lingüística"
"RD-000558","Cuácari","Cuácari","cuacari","","S","S","Tipo de ave gris con pecho rojo que grita: “cóa”.","1","[""Tipo de ave gris con pecho rojo que grita: “cóa”.""]","0","[]","0","[]","","SRC-02","DICCIONARIO raramuri.pdf","30","30","Transcrito","Autorizada para difusión","Pendiente de validación lingüística"
"RD-000559","Cúchara","Cúchara","cuchara","","S","S","Hijos","1","[""Hijos""]","1","[""[sing.: ranara].""]","1","[""sing.: ranara""]","[sing.: ranara].","SRC-02","DICCIONARIO raramuri.pdf","30","30","Transcrito","Autorizada para difusión","Pendiente de validación lingüística"
"RD-000560","Cuchi","Cuchi","cuchi","","Adj pl","Adj","Chiquitos","1","[""Chiquitos""]","1","[""[sing.: ta]""]","1","[""sing.: ta""]","[sing.: ta]","SRC-02","DICCIONARIO raramuri.pdf","30","30","Transcrito","Autorizada para difusión","Pendiente de validación lingüística"
"RD-000561","Cuchíhua","Cuchíhua","cuchihua","","Vi","Vi","Agusanarse","1","[""Agusanarse""]","1","[""Chabé mucuri echi cochí, ma cáraca cuchíhuari. Hace tiempo murió ese perro; ya está completamente agusanado. Cuchíhuari, s Gusano de la carne""]","0","[]","Chabé mucuri echi cochí, ma cáraca cuchíhuari. Hace tiempo murió ese perro; ya está completamente agusanado. Cuchíhuari, s Gusano de la carne","SRC-02","DICCIONARIO raramuri.pdf","30","30","Transcrito","Autorizada para difusión","Pendiente de validación lingüística"
"RD-000562","Cuchípara","Cuchípara","cuchipara","","S","S","Los puestos menores (entre las autoridades del pueblo)","1","[""Los puestos menores (entre las autoridades del pueblo)""]","0","[]","0","[]","","SRC-02","DICCIONARIO raramuri.pdf","30","30","Transcrito","Autorizada para difusión","Pendiente de validación lingüística"
"RD-000563","Cúchuhua","Cúchuhua","cuchuhua","","Vt","Vt","Tener hijos","1","[""Tener hijos""]","1","[""¿Chu quipi mi cúchuhua? ¿Cuántos hijos tienes? Cúchuami, adj Que tiene hijos. Nijé cúchuhuara, mis hijos.""]","0","[]","¿Chu quipi mi cúchuhua? ¿Cuántos hijos tienes? Cúchuami, adj Que tiene hijos. Nijé cúchuhuara, mis hijos.","SRC-02","DICCIONARIO raramuri.pdf","30","30","Transcrito","Autorizada para difusión","Pendiente de validación lingüística"
"RD-000564","Cuchuri","1Cuchuri","cuchuri","1","S","S","Grillo, oruga","1","[""Grillo, oruga""]","1","[""Cuchuri hue cusú. Los grillos chirrían mucho.""]","0","[]","Cuchuri hue cusú. Los grillos chirrían mucho.","SRC-02","DICCIONARIO raramuri.pdf","30","30","Transcrito","Autorizada para difusión","Pendiente de validación lingüística"
"RD-000565","Cuchiri","2Cuchiri","cuchiri","2","S pl","S","Perritos","1","[""Perritos""]","1","[""[sing.: churi]""]","1","[""sing.: churi""]","[sing.: churi]","SRC-02","DICCIONARIO raramuri.pdf","30","30","Transcrito","Autorizada para difusión","Pendiente de validación lingüística"
"RD-000566","Cuhuana","1Cuhuana","cuhuana","1","Vt","Vt","1. Tostar 2. Quemar (por el sol)","2","[""Tostar"",""Quemar (por el sol)""]","1","[""¡Rimé cuhuana! ¡Tuesta la tortilla! Echi rayénari cara cuhuánari echi pachí. El sol quemó completamente las matas de maíz [fut.: cuhuanáma]. Cuhuanámari adj tostado.""]","1","[""fut.: cuhuanáma""]","¡Rimé cuhuana! ¡Tuesta la tortilla! Echi rayénari cara cuhuánari echi pachí. El sol quemó completamente las matas de maíz [fut.: cuhuanáma]. Cuhuanámari adj tostado.","SRC-02","DICCIONARIO raramuri.pdf","30","30","Transcrito","Autorizada para difusión","Pendiente de validación lingüística"
"RD-000567","Cuhuana","2Cuhuana","cuhuana","2","Adv","Adv","1. Al otro lado, detrás 2. De nuevo","2","[""Al otro lado, detrás"",""De nuevo""]","1","[""Huamí corí cuhuana bité. Él vive al otro lado (del cerro). Aboni auchecho cu cuhuana mi bayema. Ellos te invitarán de nuevo. Cochí cuhuana yori. El perro se enojó de nuevo.""]","0","[]","Huamí corí cuhuana bité. Él vive al otro lado (del cerro). Aboni auchecho cu cuhuana mi bayema. Ellos te invitarán de nuevo. Cochí cuhuana yori. El perro se enojó de nuevo.","SRC-02","DICCIONARIO raramuri.pdf","30","30","Transcrito","Autorizada para difusión","Pendiente de validación lingüística"
"RD-000568","Cuhuara","Cuhuara","cuhuara","","S","S","La punta (de pino, grano de maíz)","1","[""La punta (de pino, grano de maíz)""]","1","[""Ocó cuhuárachi atí biré cusá. En la punta del pino está una aguililla.""]","0","[]","Ocó cuhuárachi atí biré cusá. En la punta del pino está una aguililla.","SRC-02","DICCIONARIO raramuri.pdf","30","30","Transcrito","Autorizada para difusión","Pendiente de validación lingüística"
"RD-000569","Cuhué","Cuhué","cuhue","","S","S","El tiempo de calor (antes de las lluvias)","1","[""El tiempo de calor (antes de las lluvias)""]","1","[""Jipi ma cu cuhué. Ya es el tiempo de calor. Cuhuesa. vi Llegar el tiempo de calor. Cuhuésachi. En el tiempo de calor.""]","0","[]","Jipi ma cu cuhué. Ya es el tiempo de calor. Cuhuesa. vi Llegar el tiempo de calor. Cuhuésachi. En el tiempo de calor.","SRC-02","DICCIONARIO raramuri.pdf","30","30","Transcrito","Autorizada para difusión","Pendiente de validación lingüística"
"RD-000570","Cuhuempa","Cuhuempa","cuhuempa","","Vt","Vt","Escardar (por primera vez antes de que llueva)","1","[""Escardar (por primera vez antes de que llueva)""]","0","[]","0","[]","","SRC-02","DICCIONARIO raramuri.pdf","30","30","Transcrito","Autorizada para difusión","Pendiente de validación lingüística"
"RD-000571","Cu’huíchara","Cu’huíchara","cu'huichara","","S","S","Manzanilla","1","[""Manzanilla""]","0","[]","0","[]","","SRC-02","DICCIONARIO raramuri.pdf","30","30","Transcrito","Autorizada para difusión","Pendiente de validación lingüística"
"RD-000572","Cu’huíichi","Cu’huíichi","cu'huiichi","","S","S","Espinilla","1","[""Espinilla""]","1","[""Hui’ré chi’huari cu’huíichi. Se hizo una cortada muy grande en la espinilla. Nijé cu’huíicharachi, en mi espinilla.""]","0","[]","Hui’ré chi’huari cu’huíichi. Se hizo una cortada muy grande en la espinilla. Nijé cu’huíicharachi, en mi espinilla.","SRC-02","DICCIONARIO raramuri.pdf","30","31","Transcrito","Autorizada para difusión","Pendiente de validación lingüística"
"RD-000573","Cu’huíimi","Cu’huíimi","cu'huiimi","","S","S","Salvador","1","[""Salvador""]","0","[]","0","[]","","SRC-02","DICCIONARIO raramuri.pdf","31","31","Transcrito","Autorizada para difusión","Pendiente de validación lingüística"
"RD-000574","Cu’huira","Cu’huira","cu'huira","","Vt","Vt","Ayudar, salvar","1","[""Ayudar, salvar""]","1","[""Binoy nahuari tamí cu’huíramia. Él vino a ayudarme. Cúrohui norínari tamí cu’huírabia. Los niños vinieron a ayudarme.""]","0","[]","Binoy nahuari tamí cu’huíramia. Él vino a ayudarme. Cúrohui norínari tamí cu’huírabia. Los niños vinieron a ayudarme.","SRC-02","DICCIONARIO raramuri.pdf","31","31","Transcrito","Autorizada para difusión","Pendiente de validación lingüística"
"RD-000575","Cuira","Cuira","cuira","","Interj","Interj","¡Hola! (saludo)","1","[""¡Hola! (saludo)""]","1","[""Cuíraga ra’íchari. Habló saludándole.""]","0","[]","Cuíraga ra’íchari. Habló saludándole.","SRC-02","DICCIONARIO raramuri.pdf","31","31","Transcrito","Autorizada para difusión","Pendiente de validación lingüística"
"RD-000576","Cujuíbara","Cujuíbara","cujuibara","","S","S","Tipo de quelite que se come","1","[""Tipo de quelite que se come""]","0","[]","0","[]","","SRC-02","DICCIONARIO raramuri.pdf","31","31","Transcrito","Autorizada para difusión","Pendiente de validación lingüística"
"RD-000577","Cu’lí","Cu’lí","cu'li","","Vi","Vi","Tirar (líquido)","1","[""Tirar (líquido)""]","0","[]","0","[]","","SRC-02","DICCIONARIO raramuri.pdf","31","31","Transcrito","Autorizada para difusión","Pendiente de validación lingüística"
"RD-000578","Cu’lina","Cu’lina","cu'lina","","Vt","Vt","1. Torcer 2. Dar vueltas 3. Voltear [fut.: cu’linama]","3","[""Torcer"",""Dar vueltas"",""Voltear [fut.: cu’linama]""]","0","[]","0","[]","","SRC-02","DICCIONARIO raramuri.pdf","31","31","Transcrito","Autorizada para difusión","Pendiente de validación lingüística"
"RD-000579","Culúami","Culúami","culuami","","Adj","Adj","Espeso","1","[""Espeso""]","1","[""Echi co’orí hue corúami ju. El esquiate está muy espeso.""]","0","[]","Echi co’orí hue corúami ju. El esquiate está muy espeso.","SRC-02","DICCIONARIO raramuri.pdf","31","31","Transcrito","Autorizada para difusión","Pendiente de validación lingüística"
"RD-000580","Cu’luhua","Cu’luhua","cu'luhua","","Vt","Vt","1. Derramar, tirar (líquido) 2. vaciar [fut.: cu’luhuama; pp.: cu’luhuárami]","2","[""Derramar, tirar (líquido)"",""vaciar [fut.: cu’luhuama; pp.: cu’luhuárami]""]","0","[]","0","[]","","SRC-02","DICCIONARIO raramuri.pdf","31","31","Transcrito","Autorizada para difusión","Pendiente de validación lingüística"
"RD-000581","Cumá","Cumá","cuma","","Vi","Vi","1. Curar (con humo, p. ej.: gente, animales, siembra) 2. Limpiar con humo (después de enterrar a un muerto","2","[""Curar (con humo, p. ej.: gente, animales, siembra)"",""Limpiar con humo (después de enterrar a un muerto""]","1","[""Ichírari cumari. Curaron la siembra. Chibá cumabo. Vamos a curar las chivas, ahumeándolas.""]","0","[]","Ichírari cumari. Curaron la siembra. Chibá cumabo. Vamos a curar las chivas, ahumeándolas.","SRC-02","DICCIONARIO raramuri.pdf","31","31","Transcrito","Autorizada para difusión","Pendiente de validación lingüística"
"RD-000582","Cumé","Cumé","cume","","Vt","Vt","Estorbar, molestar","1","[""Estorbar, molestar""]","1","[""Tamí cumé. Me estorba. Echi rijoy huabé tamí cumeri. Ese hombre me estorbó mucho.""]","0","[]","Tamí cumé. Me estorba. Echi rijoy huabé tamí cumeri. Ese hombre me estorbó mucho.","SRC-02","DICCIONARIO raramuri.pdf","31","31","Transcrito","Autorizada para difusión","Pendiente de validación lingüística"
"RD-000583","Cumí","Cumí","cumi","","Vt","Vt","Comer (cosas duras como fruta, galletas, dulces)","1","[""Comer (cosas duras como fruta, galletas, dulces)""]","1","[""¿Acha cumumea galletas? ¿Comerá algunas galletas? [fut.: cumumea]. Cumuyá. Comiéndolo así.""]","1","[""fut.: cumumea""]","¿Acha cumumea galletas? ¿Comerá algunas galletas? [fut.: cumumea]. Cumuyá. Comiéndolo así.","SRC-02","DICCIONARIO raramuri.pdf","31","31","Transcrito","Autorizada para difusión","Pendiente de validación lingüística"
"RD-000584","Cumi","Cumi","cumi","","Adv","Adv","¿Dónde?, ¿A dónde?","1","[""¿Dónde?, ¿A dónde?""]","1","[""¿Cumi simí? ¿A dónde vas?""]","0","[]","¿Cumi simí? ¿A dónde vas?","SRC-02","DICCIONARIO raramuri.pdf","31","31","Transcrito","Autorizada para difusión","Pendiente de validación lingüística"
"RD-000585","Cumúchari","Cumúchari","cumuchari","","S","S","Tío (el hermano mayor del padre)","1","[""Tío (el hermano mayor del padre)""]","1","[""Nijé cumúchara. Mi tío.""]","0","[]","Nijé cumúchara. Mi tío.","SRC-02","DICCIONARIO raramuri.pdf","31","31","Transcrito","Autorizada para difusión","Pendiente de validación lingüística"
"RD-000586","Cumurachi","Cumurachi","cumurachi","","S","S","Casa de la comunidad","1","[""Casa de la comunidad""]","0","[]","0","[]","","SRC-02","DICCIONARIO raramuri.pdf","31","31","Transcrito","Autorizada para difusión","Pendiente de validación lingüística"
"RD-000587","Cuná","Cuná","cuna","","S","S","Marido, esposo","1","[""Marido, esposo""]","1","[""Mujé cunara. Tu marido. ‘yemi ucunara. Sus maridos (de ustedes).""]","0","[]","Mujé cunara. Tu marido. ‘yemi ucunara. Sus maridos (de ustedes).","SRC-02","DICCIONARIO raramuri.pdf","31","31","Transcrito","Autorizada para difusión","Pendiente de validación lingüística"
"RD-000588","Cunama","Cunama","cunama","","Vi","Vi","Enviudar (la mujer)","1","[""Enviudar (la mujer)""]","1","[""Ma cunámari. Enviudó la mujer.""]","0","[]","Ma cunámari. Enviudó la mujer.","SRC-02","DICCIONARIO raramuri.pdf","31","31","Transcrito","Autorizada para difusión","Pendiente de validación lingüística"
"RD-000589","Cunámami","Cunámami","cunamami","","S","S","viuda","1","[""viuda""]","1","[""[pl.: cunámacami].""]","1","[""pl.: cunámacami""]","[pl.: cunámacami].","SRC-02","DICCIONARIO raramuri.pdf","31","31","Transcrito","Autorizada para difusión","Pendiente de validación lingüística"
"RD-000590","Cuné","Cuné","cune","","Vi","Vi","Tener marido, estar casada","1","[""Tener marido, estar casada""]","1","[""[pp.: cunéami]-""]","1","[""pp.: cunéami""]","[pp.: cunéami]-","SRC-02","DICCIONARIO raramuri.pdf","31","31","Transcrito","Autorizada para difusión","Pendiente de validación lingüística"
"RD-000591","Cupá","Cupá","cupa","","S","S","Pelo, cabello","1","[""Pelo, cabello""]","1","[""Nijé cupara. Mi cabello.""]","0","[]","Nijé cupara. Mi cabello.","SRC-02","DICCIONARIO raramuri.pdf","31","31","Transcrito","Autorizada para difusión","Pendiente de validación lingüística"
"RD-000592","Cupé","Cupé","cupe","","Vi","Vi","Tener cabello","1","[""Tener cabello""]","1","[""[pp.: cupéami].""]","1","[""pp.: cupéami""]","[pp.: cupéami].","SRC-02","DICCIONARIO raramuri.pdf","31","31","Transcrito","Autorizada para difusión","Pendiente de validación lingüística"
"RD-000593","Cupí","Cupí","cupi","","Vi","Vi","Cerrar los ojos","1","[""Cerrar los ojos""]","1","[""Cupugá ra’ichabo Riosi yuhua. Cerrando los ojos vamos a orar a Dios. [fut.: cupuméa; pp.: cupíami]. Cupugá. Cerrando los ojos. Cupusí. ¡Cierren los ojos!""]","1","[""fut.: cupuméa; pp.: cupíami""]","Cupugá ra’ichabo Riosi yuhua. Cerrando los ojos vamos a orar a Dios. [fut.: cupuméa; pp.: cupíami]. Cupugá. Cerrando los ojos. Cupusí. ¡Cierren los ojos!","SRC-02","DICCIONARIO raramuri.pdf","31","31","Transcrito","Autorizada para difusión","Pendiente de validación lingüística"
"RD-000594","Cupisi","Cupisi","cupisi","","S","S","Luciérnaga","1","[""Luciérnaga""]","0","[]","0","[]","","SRC-02","DICCIONARIO raramuri.pdf","31","31","Transcrito","Autorizada para difusión","Pendiente de validación lingüística"
"RD-000595","Cupuchá","Cupuchá","cupucha","","Vi","Vi","Pestañear","1","[""Pestañear""]","0","[]","0","[]","","SRC-02","DICCIONARIO raramuri.pdf","31","31","Transcrito","Autorizada para difusión","Pendiente de validación lingüística"
"RD-000596","Cu’rí","Cu’rí","cu'ri","","Vi","Vi","Dar vueltas, revolver","1","[""Dar vueltas, revolver""]","0","[]","0","[]","","SRC-02","DICCIONARIO raramuri.pdf","31","31","Transcrito","Autorizada para difusión","Pendiente de validación lingüística"
"RD-000597","Curi","Curi","curi","","S","S","Malacate","1","[""Malacate""]","0","[]","0","[]","","SRC-02","DICCIONARIO raramuri.pdf","31","31","Transcrito","Autorizada para difusión","Pendiente de validación lingüística"
"RD-000598","Curícari","Curícari","curicari","","S","S","Hilo de lana, pedazos de hilo (que sobra al hacer una cobija)","1","[""Hilo de lana, pedazos de hilo (que sobra al hacer una cobija)""]","0","[]","0","[]","","SRC-02","DICCIONARIO raramuri.pdf","32","32","Transcrito","Autorizada para difusión","Pendiente de validación lingüística"
"RD-000599","Curichi","Curichi","curichi","","S","S","Tío (hermano mayor de la madre)","1","[""Tío (hermano mayor de la madre)""]","1","[""Nijé curíchara. Mi tío.""]","0","[]","Nijé curíchara. Mi tío.","SRC-02","DICCIONARIO raramuri.pdf","32","32","Transcrito","Autorizada para difusión","Pendiente de validación lingüística"
"RD-000600","Curipi","Curipi","curipi","","","Sin clasificar","Hace poco","1","[""Hace poco""]","0","[]","0","[]","","SRC-02","DICCIONARIO raramuri.pdf","32","32","Transcrito","Autorizada para difusión","Pendiente de validación lingüística"
"RD-000601","Cursi","Cursi","cursi","","S","S","Cruz","1","[""Cruz""]","0","[]","0","[]","","SRC-02","DICCIONARIO raramuri.pdf","32","32","Transcrito","Autorizada para difusión","Pendiente de validación lingüística"
"RD-000602","Curú","1Curú","curu","1","S","S","Palmillo con que hacen canastas","1","[""Palmillo con que hacen canastas""]","0","[]","0","[]","","SRC-02","DICCIONARIO raramuri.pdf","32","32","Transcrito","Autorizada para difusión","Pendiente de validación lingüística"
"RD-000603","Curú","2Curú","curu","2","Vi","Vi","Espesarse","1","[""Espesarse""]","1","[""Hue cururi. Se hizo espeso. [fut.: curuméa].""]","1","[""fut.: curuméa""]","Hue cururi. Se hizo espeso. [fut.: curuméa].","SRC-02","DICCIONARIO raramuri.pdf","32","32","Transcrito","Autorizada para difusión","Pendiente de validación lingüística"
"RD-000604","Cúruhui","Cúruhui","curuhui","","S pl","S","Niños, muchachos, chamacos","1","[""Niños, muchachos, chamacos""]","1","[""[sing.: tohuí].""]","1","[""sing.: tohuí""]","[sing.: tohuí].","SRC-02","DICCIONARIO raramuri.pdf","32","32","Transcrito","Autorizada para difusión","Pendiente de validación lingüística"
"RD-000605","Cu’runi","Cu’runi","cu'runi","","Vi","Vi","Estar dando vueltas","1","[""Estar dando vueltas""]","0","[]","0","[]","","SRC-02","DICCIONARIO raramuri.pdf","32","32","Transcrito","Autorizada para difusión","Pendiente de validación lingüística"
"RD-000606","Curusú","Curusú","curusu","","Vt","Vt","Saludar (tocando el brazo del otro)","1","[""Saludar (tocando el brazo del otro)""]","0","[]","0","[]","","SRC-02","DICCIONARIO raramuri.pdf","32","32","Transcrito","Autorizada para difusión","Pendiente de validación lingüística"
"RD-000607","Cusá","Cusá","cusa","","S","S","Aguililla, gavilán blanco (ave)","1","[""Aguililla, gavilán blanco (ave)""]","0","[]","0","[]","","SRC-02","DICCIONARIO raramuri.pdf","32","32","Transcrito","Autorizada para difusión","Pendiente de validación lingüística"
"RD-000608","Cusabi","Cusabi","cusabi","","S","S","Capulín","1","[""Capulín""]","1","[""Cusabi racará. Fruta del capulín.""]","0","[]","Cusabi racará. Fruta del capulín.","SRC-02","DICCIONARIO raramuri.pdf","32","32","Transcrito","Autorizada para difusión","Pendiente de validación lingüística"
"RD-000609","Cusé","Cusé","cuse","","Vt","Vt","Tocar la flauta","1","[""Tocar la flauta""]","1","[""[pp.: cuséami].""]","1","[""pp.: cuséami""]","[pp.: cuséami].","SRC-02","DICCIONARIO raramuri.pdf","32","32","Transcrito","Autorizada para difusión","Pendiente de validación lingüística"
"RD-000610","Cuseba","Cuseba","cuseba","","Vi","Vi","Ahogarse, colgarse","1","[""Ahogarse, colgarse""]","1","[""Ma huijaga cusébari. Ya se colgó.""]","0","[]","Ma huijaga cusébari. Ya se colgó.","SRC-02","DICCIONARIO raramuri.pdf","32","32","Transcrito","Autorizada para difusión","Pendiente de validación lingüística"
"RD-000611","Cusébana","Cusébana","cusebana","","Vt","Vt","Ahorcar, agarrotar, estrangular","1","[""Ahorcar, agarrotar, estrangular""]","0","[]","0","[]","","SRC-02","DICCIONARIO raramuri.pdf","32","32","Transcrito","Autorizada para difusión","Pendiente de validación lingüística"
"RD-000612","Cusera","1Cusera","cusera","1","Vt","Vt","Poner mango al hacha","1","[""Poner mango al hacha""]","1","[""Ripurá cuséramani. Voy a poner un mango nuevo al hacha.""]","0","[]","Ripurá cuséramani. Voy a poner un mango nuevo al hacha.","SRC-02","DICCIONARIO raramuri.pdf","32","32","Transcrito","Autorizada para difusión","Pendiente de validación lingüística"
"RD-000613","Cusera","2Cusera","cusera","2","S","S","Flauta","1","[""Flauta""]","0","[]","0","[]","","SRC-02","DICCIONARIO raramuri.pdf","32","32","Transcrito","Autorizada para difusión","Pendiente de validación lingüística"
"RD-000614","Cusí","1Cusí","cusi","1","S","S","Palo","1","[""Palo""]","1","[""ripurá cusirá. Mango del hacha.""]","0","[]","ripurá cusirá. Mango del hacha.","SRC-02","DICCIONARIO raramuri.pdf","32","32","Transcrito","Autorizada para difusión","Pendiente de validación lingüística"
